{
    "$schema": "http://json-schema.org/draft-04/schema#",
    "description": "This schema represents the random experience questions for the MD2K smoking detection study.",
    "type": "object",
    "references": [
        {
            "description": "This is a custom questionnaire."
        },
        {
            "description": "The SNOMED code represents Tobacco smoking behavior (finding)",
            "url": "http://purl.bioontology.org/ontology/SNOMEDCT/365981007"
        }
    ],
    "definitions": {
        "date_time": {
            "$ref": "date-time-1.x.json"
        },
        "generic_question_yesno": {
            "$ref": "generic-question-yesno-1.x.json"
        },
        "generic_question_text": {
            "$ref": "generic-question-text-1.x.json"
        }
    },
    "properties": {
        "items": {
            "type": "array",
            "items": [
                {
                    "type": "object",
                    "allOf": [
                        {
                            "$ref": "#/definitions/generic_question_yesno"
                        },
                        {
                            "properties": {
                                "question": {
                                    "enum": [
                                        {
                                            "code": "EXPSmo",
                                            "text": "Have you smoked since the last time you recorded anything on the phone?"
                                        }
                                    ]
                                },
                                "start_date_time": {
                                    "$ref": "#/definitions/date_time"
                                },
                                "end_date_time": {
                                    "$ref": "#/definitions/date_time"
                                }
                            }
                        }
                    ]
                },
                {
                    "type": "object",
                    "allOf": [
                        {
                            "$ref": "#/definitions/generic_question_text"
                        },
                        {
                            "properties": {
                                "question": {
                                    "description": "If EXPSmo = 1, then EXPSmoText is displayed.",
                                    "enum": [
                                        {
                                            "code": "EXPSmoText",
                                            "text": "How did it feel to inhale that first puff?"
                                        }
                                    ]
                                }
                            }
                        }
                    ]
                }
            ]
        },
        "first_delivered_date_time": {
            "$ref": "#/definitions/date_time"
        },
        "start_date_time": {
            "$ref": "#/definitions/date_time"
        },
        "last_available_date_time": {
            "$ref": "#/definitions/date_time"
        },
        "delay_start_date_time": {
            "$ref": "#/definitions/date_time"
        },
        "delay_end_date_time": {
            "$ref": "#/definitions/date_time"
        },
        "status": {
            "type": "string",
            "enum": ["successful","missed","abandoned"]
        }
    },
    "required": ["first_delivered_date_time","status"]
}