{
    "items": [
        {
            "question": {
                "label": "EXPSmo",
                "text": "Have you smoked since the last time you recorded anything on the phone?"
            },
            "answer": {
                "code": 1,
                "text": "yes"
            },
            "date_time_asked": "2015-02-05T07:24:10Z",
            "date_time_answered": "2015-02-05T07:24:40Z"
        },
        {
            "question": {
                "label": "EXPSmoTime",
                "text": "Approximately how long ago did you take the first puff from that cigarette?"
            },
            "answer": {
                "value": 30,
                "unit": "min"
            },
            "date_time_asked": "2015-02-05T07:24:50Z",
            "date_time_answered": "2015-02-05T07:25:00Z"
        },
        {
            "question": {
                "label": "EXPSmoText",
                "text": "How did it feel to inhale that first puff?"
            },
            "answer": "Bad taste in my mouth",
            "date_time_asked": "2015-02-05T07:25:10Z",
            "date_time_answered": "2015-02-05T07:25:40Z"
        },
        {
            "question": {
                "label": "DDTFB",
                "text": "Please check the hour blocks when you took 1 or more puffs today."
            },
            "answer": [
                "1pm-2pm",
                "4pm-5pm",
                "7pm-8pm"
            ],
            "date_time_asked": "2015-02-05T07:27:10Z",
            "date_time_answered": "2015-02-05T07:27:40Z"
        },
        {
            "question": {
                "label": "SUrge",
                "text": "How strong is your urge to smoke right now?"
            },
            "answer": {
                "code": 2,
                "text": "moderate"
            },
            "date_time_asked": "2015-02-05T07:26:10Z",
            "date_time_answered": "2015-02-05T07:26:40Z"
        },
        {
            "question": {
                "label": "SStress1r",
                "text": "I feel cheerful."
            },
            "answer": {
                "code": 2,
                "text": "no"
            },
            "date_time_asked": "2015-02-05T07:27:10Z",
            "date_time_answered": "2015-02-05T07:27:40Z"
        },
        {
            "question": {
                "label": "SStress2r",
                "text": "I feel happy."
            },
            "answer": {
                "code": 1,
                "text": "NO"
            },
            "date_time_asked": "2015-02-05T07:28:10Z",
            "date_time_answered": "2015-02-05T07:28:40Z"
        }
    ],
    "first_delivered_date_time": "2015-02-05T07:24:00Z",
    "start_date_time": "2015-02-05T07:24:10Z",
    "status": "successful"
}
