{
    "items": [
        {
            "question": {
                "code": "EXPSmo",
                "text": "Have you smoked since the last time you recorded anything on the phone?"
            },
            "answer": {
                "code": 1,
                "text": "yes"
            },
            "start_date_time": "2015-02-05T07:24:10Z",
            "end_date_time": "2015-02-05T07:24:40Z"
        },
        {
            "question": {
                "code": "EXPSmoTime",
                "text": "Approximately how long ago did you take the first puff from that cigarette?"
            },
            "answer": {
                "value": 30,
                "unit": "min"
            },
            "start_date_time": "2015-02-05T07:24:50Z",
            "end_date_time": "2015-02-05T07:25:00Z"
        },
        {
            "question": {
                "code": "EXPSmoText",
                "text": "How did it feel to inhale that first puff?"
            },
            "answer": "Bad taste in my mouth",
            "start_date_time": "2015-02-05T07:25:10Z",
            "end_date_time": "2015-02-05T07:25:40Z"
        },
        {
            "question": {
                "code": "SUrge",
                "text": "How strong is your urge to smoke right now?"
            },
            "answer": {
                "code": 2,
                "text": "moderate"
            },
            "start_date_time": "2015-02-05T07:26:10Z",
            "end_date_time": "2015-02-05T07:26:40Z"
        }
    ],
    "first_delivered_date_time": "2015-02-05T07:24:00Z",
    "start_date_time": "2015-02-05T07:24:10Z",
    "status": "successful"
}
